{
  "mission_id": "EXTEND_01_M2_REAL_E2E",
  "mission_mode": "REDUCED",
  "artifact_id": "EXTEND_01_M2_REAL_E2E_PREPARATION",
  "artifact_version": "1.0.0",
  "authorized_paths": ["plans/001_CONTROL_OPERATIVO.md", "plans/extend_01/m2/", "config/capability_registry.json", "config/capability_routing.yaml", "config/responsibility_registry.json", "config/agent_prompt_registry.json", "schemas/human_episode_input.json", "schemas/episode_brief.json", "schemas/research_channel_context.json", "schemas/research_source_access.json", "schemas/research_plan_proposal.json", "src/cli.py", "src/application/interaction.py", "src/application/contracts.py", "src/application/storage.py", "src/application/research_planning.py", "src/application/research_b2.py", "src/application/research_b3.py", "src/application/research_b4.py", "src/application/research_m7.py", "src/application/research_m7_fixture.py", "src/ai/role_execution.py", "prompts/roles/RESEARCH_AND_CURATION/1.1.0.md", ".agent/skills/skill_research_tema_y_obras.md", "tests/ai/test_role_execution_contract.py", "tests/ai/test_hybrid_runtime.py", "tests/core/test_plan_005_authority_reconciliation.py", "tests/core/test_application_intake.py", "tests/core/test_plan012_m2_contracts.py", "tests/core/test_plan012_m3_b2_base_research.py", "tests/core/test_plan012_m4_b3_deep_research.py", "tests/core/test_plan012_m5_b3_post_deep.py", "tests/core/test_plan012_m6_b4_research_ready.py", "tests/core/test_all_schemas.py", "tests/core/test_execution_preflight_context_lineage.py", "tests/harness/test_plan012_m7_b5.py"],
  "protected_untracked_paths": [".agents/skills/tests-validacion-cierre/"],
  "protected_untracked_baseline": [{"path": ".agents/skills/tests-validacion-cierre/SKILL.md", "sha256": "41cee8fb79b1b00ebd72b65c7088960f8f4a6a1c241444c481750127aef04334"}],
  "required_tests": [
    {"label": "AUTHORITY_AND_INTAKE", "command": ["py", "-3", "-m", "pytest", "-q", "tests/core/test_plan_005_authority_reconciliation.py", "tests/core/test_application_intake.py", "tests/core/test_execution_preflight_context_lineage.py"], "timeout_seconds": 300},
    {"label": "CONTRACTS_AND_SCHEMAS", "command": ["py", "-3", "-m", "pytest", "-q", "tests/core/test_all_schemas.py", "tests/core/test_plan012_m2_contracts.py"], "timeout_seconds": 300},
    {"label": "RESEARCH_VERTICAL", "command": ["py", "-3", "-m", "pytest", "-q", "tests/ai/test_role_execution_contract.py", "tests/core/test_plan012_m3_b2_base_research.py", "tests/core/test_plan012_m4_b3_deep_research.py", "tests/core/test_plan012_m5_b3_post_deep.py", "tests/core/test_plan012_m6_b4_research_ready.py"], "timeout_seconds": 300},
    {"label": "RUNTIME_AND_ENTRYPOINT", "command": ["py", "-3", "-m", "pytest", "-q", "tests/ai/test_hybrid_runtime.py", "tests/harness/test_plan012_m7_b5.py"], "timeout_seconds": 300}
  ],
  "push_allowed": false,
  "push_guard": {"remote": "LOCAL", "ref": "HEAD", "baseline_remote_commit": "9ce500670efa4902b8c251594c0a339a031e1c13"},
  "contains_material_repair": true,
  "repair_integrity_evidence_path": "plans/extend_01/m2/repair_integrity_evidence.json",
  "mission_authorization_path": "plans/extend_01/m2/mission-authorization-preparation.json",
  "mission_authorization_sha256": "2bbacff47a2ad34745f602901811cc97f673f4a3de75d4c3e9587b51c25b12cb",
  "state_requirements": {"control_path": "plans/001_CONTROL_OPERATIVO.md", "required": {"CURRENT_MISSION": "EXTEND_01_M2_REAL_E2E", "EXTEND_01_ACTIVE": "YES", "M2_AUTHORIZED": "YES", "MVP_PROVIDER_SELECTION_REQUIRED": "NO", "MVP_MODEL_SELECTION_REQUIRED": "NO", "MVP_RUNTIME_SELECTION_REQUIRED": "NO", "MVP_HARNESS_SELECTION_REQUIRED": "NO", "REAL_AI_EXECUTION": "NO", "M2_REAL_EXECUTION": "NOT_RUN", "REAL_ENTRYPOINT_OPERATIONAL": "NO"}, "forbidden": {"AUTHORIZED_FOR_PRODUCT_USE": ["YES", "AUTHORIZED", "ACTIVE"], "REAL_AI_EXECUTION": ["YES", "AUTHORIZED", "DEMONSTRATED"], "M2_REAL_EXECUTION": ["PASS", "YES", "DEMONSTRATED"], "REAL_ENTRYPOINT_OPERATIONAL": ["YES"]}},
  "schema_checks": [{"path": "plans/extend_01/m2/mission_contract_preparation.json", "schema": "mission_contract"}, {"path": "plans/extend_01/m2/repair_integrity_evidence.json", "schema": "repair_integrity_evidence"}],
  "objective": "Preparar B1-B3 de EXTEND-01 sin ejecutar cognición REAL ni autorizar uso productivo.",
  "preconditions": ["La autoridad canónica es resoluble.", "La preparación utiliza únicamente la familia sintética AGENT_HARNESS."],
  "canonical_inputs": ["HumanInput", "EpisodeBrief PRE_RESEARCH", "EditorialProfile", "ResearchChannelContext", "ResearchSourceAccess", "ResearchPlanningService"],
  "allowed_files": ["plans/001_CONTROL_OPERATIVO.md", "plans/extend_01/m2/", "config/capability_registry.json", "config/capability_routing.yaml", "config/responsibility_registry.json", "config/agent_prompt_registry.json", "schemas/human_episode_input.json", "schemas/episode_brief.json", "schemas/research_channel_context.json", "schemas/research_source_access.json", "schemas/research_plan_proposal.json", "src/cli.py", "src/application/interaction.py", "src/application/contracts.py", "src/application/storage.py", "src/application/research_planning.py", "src/application/research_b2.py", "src/application/research_b3.py", "src/application/research_b4.py", "src/application/research_m7.py", "src/application/research_m7_fixture.py", "src/ai/role_execution.py", "prompts/roles/RESEARCH_AND_CURATION/1.1.0.md", ".agent/skills/skill_research_tema_y_obras.md", "tests/ai/test_role_execution_contract.py", "tests/ai/test_hybrid_runtime.py", "tests/core/test_plan_005_authority_reconciliation.py", "tests/core/test_application_intake.py", "tests/core/test_plan012_m2_contracts.py", "tests/core/test_plan012_m3_b2_base_research.py", "tests/core/test_plan012_m4_b3_deep_research.py", "tests/core/test_plan012_m5_b3_post_deep.py", "tests/core/test_plan012_m6_b4_research_ready.py", "tests/core/test_all_schemas.py", "tests/core/test_execution_preflight_context_lineage.py", "tests/harness/test_plan012_m7_b5.py"],
  "non_objectives": ["Ejecución REAL", "B4 REAL", "búsqueda web", "HTTP fetch", "uso productivo", "commit", "push"],
  "expected_outputs": ["Contratos PRE_RESEARCH válidos", "ResearchPlan 2.0.0 enlazable", "Evidencia de tests focales", "Ruta REAL mantenida fail-closed"],
  "deterministic_validations": ["Parser canónico sin claves duplicadas", "Schemas Draft-07 y fixtures", "Compatibilidad HumanInput 1/2/3", "No llamadas externas"],
  "adversarial_cases": ["Campos técnicos del entorno del OWNER", "Fixtures clasificados como REAL", "Autorización REAL reutilizada en PREPARATION"],
  "stop_conditions": ["Fallo de autoridad", "Entrada B2 no resoluble sin inventar datos", "Necesidad de ampliar arquitectura", "Cualquier llamada externa"],
  "review_policy": {"required_review": "OWNER_REVIEW", "independent_review": "REQUIRED", "owner_review": true},
  "owner_closure": {"required": false}
}
